{
  "$ref": "#/definitions/portfolio",
  "definitions": {
    "portfolio": {
      "type": "object",
      "properties": {
        "id": {
          "type": "string"
        },
        "title": {
          "type": "string"
        },
        "category": {
          "type": "string"
        },
        "tags": {
          "type": "string"
        },
        "img": {
          "type": "string"
        },
        "link": {
          "type": "string"
        },
        "modal": {
          "type": "object",
          "properties": {
            "title": {
              "type": "string"
            },
            "project": {
              "type": "string"
            },
            "client": {
              "type": "string"
            },
            "languages": {
              "type": "string"
            },
            "preview": {
              "type": "string"
            },
            "link": {
              "type": "string"
            },
            "description": {
              "type": "string"
            },
            "img": {
              "type": "string"
            }
          },
          "required": [
            "title",
            "project",
            "client",
            "languages",
            "preview",
            "link",
            "description",
            "img"
          ],
          "additionalProperties": false
        },
        "$schema": {
          "type": "string"
        }
      },
      "required": [
        "id",
        "title",
        "category",
        "tags",
        "img",
        "link",
        "modal"
      ],
      "additionalProperties": false
    }
  },
  "$schema": "http://json-schema.org/draft-07/schema#"
}