{
  "id": "portfolio-3",
  "title": "The Red Shed",
  "category": "Small business",
  "tags": "ui/ux, website, content management, small business",
  "img": "/assets/work-images/longIsland.webp",
  "link": "#portfolioFive",
  "modal": {
    "title": "The Red Shed",
    "project": "Website with content management system",
    "client": "Red Shed LLC.",
    "languages": "Next.js, Content Management, TailwindCSS",
    "preview": "redshedmadison.com",
    "link": "https://www.redshedmadison.com/building",
    "description": "The Red Shed is a historic small business in Madison WI. They recently had a website built to welcome the business into the digital age. I had the honor or creating this site with help from a wonderful designer. This project includes a content management system so that the owners can update their hours, menu, promos, and much more without the need for an engineer to step in.",
    "img": "/assets/work-images/red-shed-screenshot.png"
  }
}
