{
  "id": "portfolio-5",
  "title": "Brodhead Aviation",
  "category": "Small business",
  "tags": "ui/ux, website",
  "img": "/assets/work-images/piet.jpeg",
  "link": "#portfolioFive",
  "modal": {
    "title": "Brodhead aviation",
    "project": "Small business website",
    "client": "Brodhead Aviation LLC.",
    "languages": "Astro.js, TailwindCSS",
    "preview": "brodheadaviation.com/",
    "link": "https://www.brodheadaviation.com/",
    "description": "Antique aircraft restoration done right. Brodhead aviation specializes in restoring antique and experimental airplanes, fabric covering and painting, common inspections and maintenance.",
    "img": "/assets/work-images/brodheadAviation.png"
  }
}
