{
  "id": "portfolio-2",
  "title": "Vally Pro",
  "category": "Payments and Scheduling",
  "tags": "advanced, portal, saas",
  "img": "/assets/work-images/scottStripedBass.png",
  "link": "#portfolioTwo",
  "modal": {
    "title": "Vally Pro",
    "project": "Payments and Scheduling Saas Product",
    "client": "Vally Pro",
    "languages": "Next.js, TailwindCSS, REST API, Stripe API, Email System",
    "preview": "vallypro.com",
    "link": "https://vallypro.com/",
    "description": "Vally Pro is an up-and-coming B2B application in the fishing industry. The application is used by business owners and their customers to schedule, book, and pay for fishing excursions and boat trips. This app has lots of complex logic going on behind the scenes and has been a blast to create.",
    "img": "/assets/work-images/vally-pro-screenshot.png"
  }
}
